{
  "$schema": "./schemas/env-config-schema.json",
  "appName": "AI.C9d",
  "displayName": "C9D Environment Tools",
  "description": "Environment management and validation tools for the C9D AI platform",
  "envVars": {
    "required": [],
    "optional": [
      {
        "name": "NODE_ENV",
        "description": "Node.js environment",
        "type": "string",
        "enum": ["development", "production", "test"],
        "default": "development"
      },
      {
        "name": "PHASE_SERVICE_TOKEN",
        "description": "Phase.dev service token for environment management",
        "type": "string",
        "sensitive": true,
        "validation": {
          "pattern": "^pss_[A-Za-z0-9]{32,}$"
        }
      },
      {
        "name": "PHASE_ENV",
        "description": "Phase.dev environment context",
        "type": "string",
        "enum": ["development", "staging", "production"],
        "default": "development"
      },
      {
        "name": "ENV_TOOLS_DEBUG",
        "description": "Enable environment tools debugging",
        "type": "boolean",
        "default": false
      }
    ]
  },
  "validation": {
    "strict": false,
    "warnOnMissing": true,
    "failOnInvalid": true
  }
}