{
  "$schema": "../env-tools/schemas/env-config-schema.json",
  "appName": "AI.C9d",
  "displayName": "C9D Phase Client",
  "description": "Phase.dev client library for the C9D AI platform",
  "envVars": {
    "required": [],
    "optional": [
      {
        "name": "NODE_ENV",
        "description": "Node.js environment",
        "type": "string",
        "enum": ["development", "production", "test"],
        "default": "development"
      },
      {
        "name": "PHASE_SERVICE_TOKEN",
        "description": "Phase.dev service token for API access",
        "type": "string",
        "sensitive": true,
        "validation": {
          "pattern": "^pss_[A-Za-z0-9]{32,}$"
        }
      },
      {
        "name": "PHASE_ENV",
        "description": "Phase.dev environment context",
        "type": "string",
        "enum": ["development", "staging", "production"],
        "default": "development"
      },
      {
        "name": "PHASE_CLIENT_DEBUG",
        "description": "Enable Phase client debugging",
        "type": "boolean",
        "default": false
      },
      {
        "name": "PHASE_CLIENT_TIMEOUT",
        "description": "Phase client API timeout in milliseconds",
        "type": "number",
        "default": 5000,
        "validation": {
          "min": 1000,
          "max": 30000
        }
      }
    ]
  },
  "validation": {
    "strict": false,
    "warnOnMissing": true,
    "failOnInvalid": true
  }
}